{
  "id": "sberbank-deposit-maximum-2024-02-03",
  "type": "deposits",
  "bankName": "СберБанк",
  "title": "Вклад Максимальный",
  "featured": true,
  "shortDescription": "Выгодный вклад с возможностью пополнения и капитализацией процентов",
  "fullDescription": "Накопительный вклад СберБанка с возможностью пополнения и частичного снятия. Проценты начисляются с капитализацией ежемесячно. Подходит для среднесрочного хранения средств с получением дохода.",
  "imageUrl": "/img/bank-logos/sberbank_logo_icon.svg",
  "features": [
    "Процент до 8.5%",
    "Ежемесячная капитализация",
    "Пополнение вклада",
    "Частичное снятие"
  ],
  "conditions": [
    "Минимальная сумма вклада: 10 000 ₽",
    "Срок вклада: от 3 месяцев до 3 лет",
    "Проценты начисляются ежемесячно",
    "Возможность пополнения вклада"
  ],
  "referralLink": "https://sber.ru/deposits",
  "version": {
    "date": "2024-02-03",
    "source": "https://sber.ru",
    "updatedBy": "system"
  },
  "parameters": {
    "main": {
      "interest_rate": "до 8.5%",
      "min_amount": "10 000 ₽",
      "max_amount": "3 000 000 ₽",
      "term": "от 3 до 36 месяцев"
    },
    "fees": {
      "opening_fee": "Бесплатно",
      "maintenance_fee": "Бесплатно",
      "early_closure_fee": "3% от суммы вклада"
    },
    "requirements": {
      "client_category": "Физические лица",
      "documents_required": [
        "Паспорт гражданина РФ",
        "ИНН (при наличии)"
      ],
      "age_requirement": "от 18 лет"
    },
    "deposit_terms": {
      "min_deposit_amount": "10000",
      "max_deposit_amount": "3000000",
      "interest_rate": "до 8.5%",
      "capitalization": "да",
      "withdrawal_options": "частичное снятие после 3 месяцев",
      "replenishment_options": "возможно",
      "term_months": "от 3 до 36"
    }
  },
  "validFrom": "2024-02-03",
  "status": "active",
  "meta": {
    "title": "Вклад Максимальный от СберБанка | Bank Select",
    "description": "Информация о вкладе Максимальный от СберБанка. Условия, процентные ставки, требования."
  }
}