{
  "id": "gazprombank-deposit-profit-2024-02-03",
  "type": "deposits",
  "bankName": "Газпромбанк",
  "title": "Вклад Процент Профи",
  "featured": true,
  "shortDescription": "Вклад с прогрессивной ставкой в зависимости от суммы",
  "fullDescription": "Накопительный вклад Газпромбанка с прогрессивной системой процентных ставок, зависящих от суммы вклада. Чем больше сумма, тем выше ставка. Проценты начисляются с капитализацией ежемесячно.",
  "imageUrl": "/img/bank-logos/gazprombank_logo_icon.svg",
  "features": [
    "Ставка до 8.5%",
    "Прогрессивная ставка",
    "Ежемесячная капитализация",
    "Пополнение вклада"
  ],
  "conditions": [
    "Минимальная сумма вклада: 50 000 ₽",
    "Срок вклада: от 3 месяцев до 2 лет",
    "Проценты начисляются ежемесячно",
    "Возможность пополнения вклада"
  ],
  "referralLink": "https://gazprombank.ru/deposits",
  "version": {
    "date": "2024-02-03",
    "source": "https://gazprombank.ru",
    "updatedBy": "system"
  },
  "parameters": {
    "main": {
      "interest_rate": "до 8.5%",
      "min_amount": "50 000 ₽",
      "max_amount": "10 000 000 ₽",
      "term": "от 3 до 24 месяцев"
    },
    "fees": {
      "opening_fee": "Бесплатно",
      "maintenance_fee": "Бесплатно",
      "early_closure_fee": "1% от суммы вклада"
    },
    "requirements": {
      "client_category": "Физические лица",
      "documents_required": [
        "Паспорт гражданина РФ",
        "ИНН (при наличии)"
      ],
      "age_requirement": "от 18 лет"
    },
    "deposit_terms": {
      "min_deposit_amount": "50000",
      "max_deposit_amount": "10000000",
      "interest_rate": "до 8.5%",
      "capitalization": "да",
      "withdrawal_options": "после окончания срока",
      "replenishment_options": "возможно",
      "term_months": "от 3 до 24"
    }
  },
  "validFrom": "2024-02-03",
  "status": "active",
  "meta": {
    "title": "Вклад Процент Профи от Газпромбанка | Bank Select",
    "description": "Информация о вкладе Процент Профи от Газпромбанка. Условия, процентные ставки, требования."
  }
}