{
  "id": "t-kn-5-0",
  "type": "credits",
  "featured": false,
  "title": "Кредит наличными",
  "bankName": "Т-Банк",
  "shortDescription": "Кредит наличными",
  "fullDescription": "Кредит наличными. Валюта кредита: Рубли Российской Федерации. Сумма кредита: От 500,000 до 5,000,000 рублей. Срок кредита: От 12 месяцев до 60 месяцев (5 лет). Процентная ставка: От 29.9% до 44.9% годовых. Полная стоимость кредита: От 29.802% до 44.802% годовых. Комиссия за выдачу и обслуживание кредита не взимается. Штраф за неоплату регулярного платежа: 0.1% от просроченной задолженности. Срок рассмотрения заявки: От 1 до 5 дней. Требования к заемщику: Гражданство РФ, возраст от 21 года, постоянная регистрация и проживание в городе с отделением Т-Банка, наличие мобильного и стационарного телефонов, постоянный доход от 10,000 рублей, трудовой стаж не менее 3 месяцев. Документы: Паспорт РФ, СНИЛС, справка о доходах. Способы погашения: Через банкоматы, интернет-банк, мобильный банк, отделения Т-Банка или партнеров.",
  "imageUrl": "https://bank-select.ru/images/products/%3Csvg xmlns='http://www.w3.org/2000/svg' height='47' viewBox='0 0 33 50' width='34' class='dI24uu' data-test-id='Main-Header-Main-DesktopLogo'%3E%3Cpath clip-rule='evenodd' d='M0 49.982v-6.825h32.61v6.825H0zm11.646-28.764h9.064L16.39 7.526h-.17l-4.573 13.692h-.001zm10.587-16.22l9.615 28.887h-7.115l-2.16-6.866H9.698l-2.33 6.867H.679l10.09-28.887C11.746 2.197 12.887 0 16.559 0s4.744 2.206 5.674 4.999v-.001z' fill='%23ef3124' fill-rule='evenodd'%3E%3C/path%3E%3C/svg%3E",
  "parameters": {
    "main": {
      "Процентная ставка": "от 29.9% до 44.9%",
      "Сумма кредита": "от 500,000 до 5,000,000 рублей",
      "Срок кредита": "от 12 месяцев до 60 месяцев (5 лет)",
      "Валюта": "Рубли Российской Федерации"
    },
    "cashback": {},
    "fees": {
      "Плата за включение в Программу страховой защиты заемщиков Банка": "Индивидуально",
      "Штраф за неоплату Регулярного платежа": "0.1% от просроченной задолженности"
    },
    "requirements": {
      "Возраст": "От 21 года",
      "Гражданство": "Российская Федерация",
      "Доход": "От 10,000 рублей",
      "Стаж работы": "Непрерывный трудовой стаж не менее 3 месяцев",
      "Документы": "Паспорт РФ, СНИЛС, справка о доходах"
    }
  },
  "meta": {
    "title": "Кредит наличными под залог недвижимости от Т-Банк",
    "description": "Нецелевой кредит под залог недвижимости"
  },
  "version": {
    "date": "2026-02-03",
    "source": "https://bank-select.ru",
    "updatedBy": "migration-script"
  },
  "validFrom": "2026-02-03",
  "status": "active"
}