{
  "id": "aliexpress-credit-card",
  "type": "credit-cards",
  "featured": true,
  "title": "Кредитная карта AliExpress от Т-Банка",
  "bankName": "Т-Банк",
  "shortDescription": "Премиальная кредитная карта для покупок в интернете и с доставкой.",
  "fullDescription": "Кредитная карта AliExpress от Т-Банка с лимитом задолженности до 1,000,000 рублей и высокими процентами начисления на покупки. Бесплатные услуги: мобильное приложение, интернет-банк, обработка в чате и по электронной почте.",
  "imageUrl": "https://bank-select.ru/images/products/aliexpress-credit-card.jpg",
  "features": [
    "Лимит задолженности до 1,000,000 рублей",
    "Высокие проценты на покупки: от 29,885% до 59,858%",
    "Бесплатные услуги: мобильное приложение, интернет-банк, обработка в чате и по электронной почте"
  ],
  "conditions": [
    "Возраст от 18 лет",
    "Документы: паспорт РФ или другой документ удостоверяющий личность",
    "Постоянный доход"
  ],
  "referralLink": "https://tbank.ru/credit-cards/aliexpress/",
  "parameters": {
    "main": {
      "Кредитный лимит": "до 1,000,000 рублей",
      "Процентная ставка": "от 29,885% до 59,858% годовых"
    },
    "fees": {
      "Выпуск карты": "бесплатно",
      "Снятие наличных": "3.9% плюс 290 руб.",
      "Переводы через сервисы Т-Банка": "2,9%, плюс 290 руб."
    },
    "requirements": {
      "Возраст": "от 18 лет",
      "Документы": [
        "Паспорт РФ или другой документ удостоверяющий личность"
      ]
    }
  },
  "meta": {
    "title": "Кредитная карта AliExpress от Т-Банка",
    "description": "Премиальная кредитная карта для покупок в интернете с высокими процентами и бесплатными услугами"
  },
  "version": {
    "date": "2026-02-03",
    "source": "https://bank-select.ru",
    "updatedBy": "migration-script"
  },
  "validFrom": "2026-02-03",
  "status": "active"
}
