{
  "id": "psb-cc-180-days-no-percent-121",
  "type": "credit-cards",
  "bankName": "ПСБ",
  "title": "Кредитная карта 180 дней без %",
  "featured": true,
  "shortDescription": "Кредитная карта с льготным периодом до 180 дней и кешбэком до 26%.",
  "fullDescription": "Кредитная карта ПСБ с льготным периодом до 180 дней. Карта предоставляет возможность пользоваться кредитными средствами без процентов в течение льготного периода. Кредитный лимит до 1 000 000 рублей. Кешбэк до 26% за покупки в супермаркетах.",
  "imageUrl": "https://bank-select.ru/images/products/psb-180-days-no-percent.jpg",
  "features": [
    "Льготный период до 180 дней",
    "Кредитный лимит до 1 000 000 ₽",
    "Кешбэк до 26% за покупки в супермаркетах",
    "Бесплатное обслуживание навсегда"
  ],
  "conditions": [
    "Возраст от 18 лет",
    "Документы: паспорт РФ",
    "Официальное трудоустройство"
  ],
  "referralLink": "https://www.psbank.ru/personal/creditcards",
  "version": {
    "date": "2026-02-03",
    "source": "https://www.psbank.ru/personal/creditcards",
    "updatedBy": "system"
  },
  "parameters": {
    "main": {
      "Кредитный лимит": "до 1 000 000 ₽",
      "Льготный период": "до 180 дней",
      "Процентная ставка": "59,99% годовых после льготного периода",
      "ПСК": "59,467%"
    },
    "fees": {
      "Выпуск карты": "бесплатно",
      "Обслуживание": "бесплатно навсегда",
      "Снятие наличных": "5,9% + 990 ₽ в сторонних банкоматах",
      "Минимальный платеж": "3% от суммы задолженности (плюс проценты, комиссии, пени)",
      "Штрафы и неустойки": "Действует на просроченную задолженность"
    },
    "requirements": {
      "Возраст": "от 18 лет",
      "Документы": [
        "Паспорт РФ"
      ],
      "Доход": "Подтверждение официального дохода"
    }
  },
  "validFrom": "2026-02-03",
  "status": "active",
  "meta": {
    "title": "Кредитная карта 180 дней без % от ПСБ",
    "description": "Кредитная карта с льготным периодом до 180 дней и кешбэком до 26% от ПСБ"
  }
}