{
  "id": "sample-mortgage-product",
  "type": "mortgage",
  "bankName": "Пример Банка",
  "title": "Ипотека на готовое жилье",
  "featured": true,
  "shortDescription": "Ипотечный кредит на приобретение готового жилья с минимальным первоначальным взносом",
  "fullDescription": "Ипотечный кредит на приобретение готового жилья от Пример Банка. Мы предлагаем выгодные условия кредитования, минимальный пакет документов и оперативное рассмотрение заявки. Подходит для приобретения квартиры, дома или комнаты на вторичном рынке.",
  "imageUrl": "/img/products/sample-mortgage.jpg",
  "features": [
    "Минимальный первоначальный взнос 15%",
    "Срок кредита до 30 лет",
    "Ставка от 9.5%",
    "Быстрое рассмотрение заявки"
  ],
  "conditions": [
    "Первоначальный взнос: от 15%",
    "Срок кредита: от 1 года до 30 лет",
    "Сумма кредита: от 300 000 до 60 000 000 ₽",
    "Требуемый доход: не менее 40 000 ₽ в месяц"
  ],
  "referralLink": "https://example-bank.ru/mortgage/ready-housing",
  "version": {
    "date": "2026-02-03",
    "source": "https://example-bank.ru",
    "updatedBy": "system"
  },
  "parameters": {
    "main": {
      "interest_rate": "9.5%",
      "min_down_payment": "15%",
      "loan_term": "от 1 до 30 лет",
      "min_loan_amount": "300 000 ₽",
      "max_loan_amount": "60 000 000 ₽"
    },
    "fees": {
      "application_fee": "Бесплатно",
      "issuance_fee": "1% от суммы кредита",
      "early_repayment_fee": "Бесплатно"
    },
    "requirements": {
      "client_category": "Физические лица",
      "age_requirement": "от 21 до 65 лет",
      "work_experience": "не менее 6 месяцев на последнем месте",
      "documents_required": [
        "Паспорт гражданина РФ",
        "Справка 2-НДФЛ или по форме банка",
        "ИНН",
        "Трудовая книжка"
      ]
    }
  },
  "validFrom": "2026-02-03",
  "status": "active",
  "meta": {
    "title": "Ипотека на готовое жилье от Пример Банка | Bank Select",
    "description": "Информация об ипотечном кредите на готовое жилье от Пример Банка. Условия, ставки, требования к заёмщику."
  }
}