{
  "id": "all-games",
  "type": "credit-cards",
  "featured": true,
  "title": "Кредитная карта ALL Games",
  "bankName": "ТрансаBank",
  "shortDescription": "Кредитная карта с высокими лимитами и удобными условиями.",
  "fullDescription": "ALL Games — это кредитная карта от ТрансаБанка, которая предлагает высокие лимиты задолженности и удобные условия для игроков в интернет-играх. Карта подходит для тех, кто хочет с легкостью финансируть свои игры без лишних забот.",
  "imageUrl": "https://bank-select.ru/images/products/all-games.jpg",
  "features": [
    "Высокий кредитный лимит до 1 000 000 рублей",
    "Удобные условия для игроков в интернет-играх"
  ],
  "conditions": [
    "Возраст от 18 лет",
    "Документы: паспорт РФ",
    "Постоянный доход"
  ],
  "referralLink": "https://transbank.ru/credit-cards/all-games/",
  "parameters": {
    "main": {
      "Кредитный лимит": "до 1 000 000 рублей",
      "Льготный период": "не применим",
      "Процентная ставка": "29,855% до 59,999% годовых"
    },
    "fees": {
      "Выпуск карты": "бесплатно",
      "Снятие наличных": "2,9% плюс 290 рублей",
      "Переводы": "2,9%, плюс 290 рублей",
      "Минимальный платеж": "не применим",
      "Штрафы и неустойки": "20% годовых при просрочке минимального платежа"
    },
    "requirements": {
      "Возраст": "от 18 лет",
      "Документы": [
        "Паспорт РФ"
      ]
    }
  },
  "meta": {
    "title": "Кредитная карта ALL Games от ТрансаBank",
    "description": "Высокий кредитный лимит и удобные условия для игроков в интернет-играх"
  },
  "version": {
    "date": "2026-02-03",
    "source": "https://bank-select.ru",
    "updatedBy": "migration-script"
  },
  "validFrom": "2026-02-03",
  "status": "active"
}
