{
  "id": "s7-premium",
  "type": "credit-cards",
  "featured": true,
  "title": "Кредитная карта S7 — T-Bank Premium",
  "bankName": "Т-Банк",
  "shortDescription": "Высокий кредитный лимит и привлекательные условия обслуживания",
  "fullDescription": "Кредитная карта S7 — T-Bank Premium предлагает высокий кредитный лимит до 2,000,000 рублей. Удобное управление через мобильное приложение, бесплатное обслуживание и привлекательные условия для различных операций.",
  "imageUrl": "https://bank-select.ru/images/products/s7-premium.jpg",
  "features": [
    "Высокий кредитный лимит до 2,000,000 рублей",
    "Бесплатное обслуживание",
    "Удобное управление через мобильное приложение"
  ],
  "conditions": [
    "Возраст от 18 лет",
    "Документы: паспорт РФ",
    "Постоянный доход"
  ],
  "referralLink": "https://tbank.ru/credit_cards/s7-premium",
  "parameters": {
    "main": {
      "Кредитный лимит": "до 2,000,000 ₽",
      "Льготный период": "Для покупок и переводов — до 55 дней, для других операций — до 30 дней",
      "Процентная ставка": "29.885% годовых для покупок и переводов, от 29.9% до 39.625% годовых для других операций"
    },
    "fees": {
      "Выпуск карты": "бесплатно",
      "Снятие наличных": "2%",
      "Переводы через T-Банк": "1%, минимум 390 ₽",
      "Оповещение об операциях": "0,89% от задолженности в месяц",
      "Страховая защита": "0.5% от задолженности в месяц",
      "Дополнительные услуги": "0.75% от задолженности в месяц"
    },
    "cashback": {
      "Кэшбэк у партнеров": "Не указано"
    },
    "requirements": {
      "Возраст": "от 18 лет",
      "Документы": [
        "Паспорт РФ"
      ]
    }
  },
  "meta": {
    "title": "Кредитная карта S7 — T-Bank Premium",
    "description": "Высокий кредитный лимит и привлекательные условия обслуживания"
  },
  "version": {
    "date": "2026-02-03",
    "source": "https://bank-select.ru",
    "updatedBy": "migration-script"
  },
  "validFrom": "2026-02-03",
  "status": "active"
}
