{
  "id": "sample-investment-product",
  "type": "investment-products",
  "bankName": "Пример Банка",
  "title": "Инвестиционный счет \"Рост\"",
  "featured": true,
  "shortDescription": "Инвестиционный счет с возможностью торговли акциями, облигациями и ETF",
  "fullDescription": "Инвестиционный счет \"Рост\" от Пример Банка позволяет инвестировать в акции, облигации и ETF российских и зарубежных компаний. Счет предусматривает минимальные комиссии и широкий выбор инструментов для построения диверсифицированного портфеля.",
  "imageUrl": "/img/products/sample-investment.jpg",
  "features": [
    "Низкие комиссии на операции",
    "Широкий выбор инвестиционных инструментов",
    "Управление портфелем через мобильное приложение",
    "Доступ к международным рынкам"
  ],
  "conditions": [
    "Минимальный взнос: 10 000 ₽",
    "Комиссия на операции: от 0.05%",
    "Комиссия за хранение: 0.15% годовых",
    "Налоги: уплачиваются инвестором самостоятельно"
  ],
  "referralLink": "https://example-bank.ru/investment/growth-account",
  "version": {
    "date": "2026-02-03",
    "source": "https://example-bank.ru",
    "updatedBy": "system"
  },
  "parameters": {
    "main": {
      "min_investment": "10 000 ₽",
      "commission_rate": "от 0.05%",
      "custody_fee": "0.15% годовых",
      "investment_options": "акции, облигации, ETF"
    },
    "fees": {
      "opening_fee": "Бесплатно",
      "management_fee": "0.15% годовых",
      "transaction_commission": "от 0.05%",
      "custody_fee": "0.15% годовых"
    },
    "requirements": {
      "client_category": "Физические лица",
      "age_requirement": "от 18 лет",
      "documents_required": [
        "Паспорт гражданина РФ",
        "ИНН",
        "Анкета инвестора"
      ]
    }
  },
  "validFrom": "2026-02-03",
  "status": "active",
  "meta": {
    "title": "Инвестиционный счет \"Рост\" от Пример Банка | Bank Select",
    "description": "Информация об инвестиционном счете \"Рост\" от Пример Банка. Условия, комиссии, доступные инструменты."
  }
}