{
  "id": "втб--1770331449888",
  "title": "Кредит \"На любые цели\"",
  "bankName": "ВТБ",
  "type": "consumer-loans",
  "featured": false,
  "shortDescription": "Кредит наличными на любые цели",
  "fullDescription": "Кредит наличными на любые цели с суммой до 10 миллионов рублей и процентной ставкой от 9.9%. Возможность досрочного погашения без штрафов.",
  "parameters": {
    "main": {
      "Процентная ставка": "от 9.9%",
      "Сумма кредита": "до 10 000 000 ₽",
      "Срок кредита": "до 10 лет"
    },
    "fees": {
      "Выдача кредита": "бесплатно",
      "Обслуживание счёта": "бесплатно"
    },
    "requirements": {
      "Возраст": "от 21 года",
      "Стаж": "от 3 месяцев на последнем месте работы"
    }
  },
  "imageUrl": "/img/products/.jpg",
  "features": [
    "от 9.9%",
    "до 10 000 000 ₽",
    "до 10 лет"
  ],
  "conditions": [
    "Возраст: от 21 года",
    "Стаж: от 3 месяцев на последнем месте работы"
  ],
  "referralLink": "https://втб.ru",
  "meta": {
    "title": "Кредит \"На любые цели\" от ВТБ",
    "description": "Кредит наличными на любые цели"
  },
  "version": {
    "date": "2026-02-05",
    "source": "system-generated",
    "updatedBy": "automated-addition"
  },
  "validFrom": "2026-02-05",
  "status": "active"
}