{
  "id": "sample-insurance-product",
  "type": "insurance-products",
  "bankName": "Пример Банка",
  "title": "Страхование жизни и здоровья",
  "featured": true,
  "shortDescription": "Комплексное страхование жизни и здоровья с покрытием от несчастных случаев",
  "fullDescription": "Программа страхования жизни и здоровья от Пример Банка предоставляет финансовую защиту вам и вашим близким в случае наступления страхового случая. Полис предусматривает покрытие от несчастных случаев, болезней и других рисков. Страховая выплата может быть использована по усмотрению застрахованного или его бенефициаров.",
  "imageUrl": "/img/products/sample-insurance.jpg",
  "features": [
    "Покрытие от несчастных случаев",
    "Лечение в лучших клиниках",
    "Выезд за границу - экстренная медицинская помощь",
    "Финансовая защита семье"
  ],
  "conditions": [
    "Возраст застрахованного: от 18 до 65 лет",
    "Срок действия полиса: 1 год",
    "Территория действия: Россия и страны Шенгенского соглашения",
    "Покрытие: до 5 000 000 ₽"
  ],
  "referralLink": "https://example-bank.ru/insurance/life-health",
  "version": {
    "date": "2026-02-03",
    "source": "https://example-bank.ru",
    "updatedBy": "system"
  },
  "parameters": {
    "main": {
      "coverage_amount": "до 5 000 000 ₽",
      "premium_rate": "от 0.5% от страховой суммы",
      "policy_term": "1 год",
      "age_range": "18-65 лет"
    },
    "fees": {
      "premium": "от 2500 ₽ в год",
      "additional_services": "оплачивается отдельно"
    },
    "requirements": {
      "client_category": "Физические лица",
      "age_requirement": "от 18 до 65 лет",
      "health_requirements": "прохождение медицинского осмотра при страховой сумме свыше 3 000 000 ₽",
      "documents_required": [
        "Паспорт гражданина РФ",
        "Медицинская справка (при необходимости)",
        "Анкета страхователя"
      ]
    }
  },
  "validFrom": "2026-02-03",
  "status": "active",
  "meta": {
    "title": "Страхование жизни и здоровья от Пример Банка | Bank Select",
    "description": "Информация о программе страхования жизни и здоровья от Пример Банка. Условия, покрытие, стоимость."
  }
}