{
  "id": "psb-loan-any-purpose-123",
  "type": "credits",
  "featured": true,
  "title": "Потребительский кредит на любые цели",
  "bankName": "ПСБ",
  "shortDescription": "Кредит наличными на любые цели с суммой от 100 тыс. до 5 млн руб.",
  "fullDescription": "Потребительский кредит от ПСБ на любые цели с суммой от 100 тысяч до 5 миллионов рублей. Кредит предоставляется на срок от 1 года до 7 лет. Процентная ставка определяется индивидуально с учетом кредитоспособности заемщика.",
  "imageUrl": "https://bank-select.ru/images/products/psb-consumer-loan.jpg",
  "features": [
    "Сумма от 100 000 до 5 000 000 ₽",
    "Срок от 1 года до 7 лет",
    "Процентная ставка от 27,9% годовых",
    "Возможность рефинансирования",
    "Без обеспечения",
    "Без справок о доходах (при определенных условиях)"
  ],
  "conditions": [
    "Возраст от 21 года до 70 лет",
    "Документы: паспорт РФ и второй документ",
    "Официальное трудоустройство",
    "Стаж не менее 6 месяцев на последнем месте"
  ],
  "referralLink": "https://www.psbank.ru/personal/credits/consumer",
  "parameters": {
    "main": {
      "Сумма кредита": "от 100 000 до 5 000 000 ₽",
      "Срок кредита": "от 12 до 84 месяцев",
      "Процентная ставка": "от 27,9% годовых",
      "ПСК": "от 27,376% до 39,999% годовых"
    },
    "fees": {
      "Выдача кредита": "бесплатно",
      "Обслуживание счёта": "бесплатно",
      "Досрочное погашение": "бесплатно",
      "Комиссия за рассмотрение заявки": "бесплатно"
    },
    "requirements": {
      "Возраст": "от 21 года до 70 лет",
      "Документы": [
        "Паспорт РФ",
        "Второй документ (СНИЛС, водительское удостоверение, загранпаспорт)"
      ],
      "Регистрация": "по месту жительства или пребывания",
      "Стаж": "не менее 6 месяцев на последнем месте работы"
    }
  },
  "meta": {
    "title": "Потребительский кредит на любые цели от ПСБ",
    "description": "Кредит наличными от ПСБ на любые цели с суммой от 100 тыс. до 5 млн руб. и ставкой от 27,9%"
  },
  "version": {
    "date": "2026-02-03",
    "source": "https://bank-select.ru",
    "updatedBy": "migration-script"
  },
  "validFrom": "2026-02-03",
  "status": "active"
}
