{
  "id": "t-kk-platinum-go-120",
  "type": "credit-cards",
  "featured": false,
  "title": "Кредитная карта Платинум Go-120",
  "bankName": "T-Банк",
  "shortDescription": "Кредитная карта с лимитом до 1,000,000 рублей и высокими процентами на операции.",
  "fullDescription": "Кредитная карта Платинум Go-120 от T-Банка с лимитом задолженности до 1,000,000 рублей. Карта предоставляет бесплатные услуги и высокие проценты на операции, включая снятие наличных, переводы и другие расходы.",
  "imageUrl": "https://bank-select.ru/images/products/t-kk-platinum-go-120.jpg",
  "features": [
    "Лимит задолженности до 1,000,000 рублей",
    "Высокие процентные ставки на операции",
    "Бесплатные услуги"
  ],
  "conditions": [
    "Возраст от 18 лет",
    "Документы: паспорт РФ",
    "Постоянный доход"
  ],
  "referralLink": "https://tbank.ru/retail/credit-cards",
  "parameters": {
    "main": {
      "Кредитный лимит": "до 1,000,000 ₽",
      "Льготный период": "не применим",
      "Процентная ставка": "58,740% годовых на операции"
    },
    "fees": {
      "Выпуск карты": "бесплатно",
      "Снятие наличных": "2,9% плюс 290 ₽",
      "Переводы": "Бесплатно",
      "Минимальный платеж": "не менее 8% от задолженности, минимум 600 ₽",
      "Штрафы и неустойки": "Действует на просроченную задолженность"
    },
    "requirements": {
      "Возраст": "от 18 лет",
      "Документы": [
        "Паспорт РФ"
      ]
    }
  },
  "meta": {
    "title": "Кредитная карта Платинум Go-120 от T-Банка",
    "description": "Кредитная карта с высокими процентными ставками и лимитом до 1,000,000 рублей"
  },
  "version": {
    "date": "2026-02-03",
    "source": "https://bank-select.ru",
    "updatedBy": "migration-script"
  },
  "validFrom": "2026-02-03",
  "status": "active"
}