{
  "id": "sberbank-personal-loan-standard-2024-02-03",
  "type": "credits",
  "bankName": "СберБанк",
  "title": "Стандартный потребительский кредит",
  "featured": true,
  "shortDescription": "Нецелевой займ на любые нужды под залог поручительства",
  "fullDescription": "Потребительский кредит СберБанка на любые цели без предоставления целевого назначения. Возможность получения без обеспечения при сумме до 500 000 рублей. Выгодные процентные ставки для зарплатных клиентов банка.",
  "imageUrl": "/img/bank-logos/sberbank_logo_icon.svg",
  "features": [
    "Ставка от 12.9%",
    "Сумма до 5 000 000 ₽",
    "Без обеспечения до 500 000 ₽",
    "До 5 лет"
  ],
  "conditions": [
    "Сумма кредита: от 50 000 до 5 000 000 ₽",
    "Срок кредита: от 1 до 5 лет",
    "Процентная ставка: от 12.9% годовых",
    "Требуется подтверждение дохода"
  ],
  "referralLink": "https://sber.ru/personal-loans",
  "version": {
    "date": "2024-02-03",
    "source": "https://sber.ru",
    "updatedBy": "system"
  },
  "parameters": {
    "main": {
      "interest_rate": "от 12.9%",
      "loan_term": "от 1 до 5 лет",
      "min_loan_amount": "50 000 ₽",
      "max_loan_amount": "5 000 000 ₽",
      "min_age": "21 год",
      "max_age": "65 лет"
    },
    "fees": {
      "application_fee": "Бесплатно",
      "issuance_fee": "2.9% от суммы кредита",
      "early_repayment_fee": "Бесплатно",
      "monthly_service_fee": "0 ₽"
    },
    "requirements": {
      "client_category": "Физические лица",
      "age_requirement": "от 21 до 65 лет",
      "work_experience": "не менее 6 месяцев на последнем месте",
      "documents_required": [
        "Паспорт гражданина РФ",
        "Справка 2-НДФЛ или по форме банка",
        "ИНН",
        "Загранпаспорт (по требованию)"
      ]
    }
  },
  "validFrom": "2024-02-03",
  "status": "active",
  "meta": {
    "title": "Стандартный потребительский кредит от СберБанка | Bank Select",
    "description": "Информация о потребительском кредите от СберБанка. Условия, ставки, требования к заёмщику."
  }
}