{
  "id": "sample-auto-loan-product",
  "type": "auto-loans",
  "bankName": "Пример Банка",
  "title": "Автокредит на новый автомобиль",
  "featured": true,
  "shortDescription": "Кредит на покупку нового автомобиля с минимальным первоначальным взносом",
  "fullDescription": "Автокредит на покупку нового автомобиля от Пример Банка. Мы предлагаем выгодные условия кредитования, минимальный пакет документов и возможность досрочного погашения без штрафов. Подходит для приобретения новых автомобилей у официальных дилеров.",
  "imageUrl": "/img/products/sample-auto-loan.jpg",
  "features": [
    "Минимальный первоначальный взнос 10%",
    "Срок кредита до 7 лет",
    "Ставка от 8.9%",
    "Без справки о доходах при сумме до 1.5 млн ₽"
  ],
  "conditions": [
    "Первоначальный взнос: от 10%",
    "Срок кредита: от 1 года до 7 лет",
    "Сумма кредита: от 200 000 до 5 000 000 ₽",
    "Возраст автомобиля: только новые"
  ],
  "referralLink": "https://example-bank.ru/auto-loans/new-car",
  "version": {
    "date": "2026-02-03",
    "source": "https://example-bank.ru",
    "updatedBy": "system"
  },
  "parameters": {
    "main": {
      "interest_rate": "8.9%",
      "min_down_payment": "10%",
      "loan_term": "от 1 до 7 лет",
      "min_loan_amount": "200 000 ₽",
      "max_loan_amount": "5 000 000 ₽"
    },
    "fees": {
      "application_fee": "Бесплатно",
      "issuance_fee": "0.5% от суммы кредита",
      "early_repayment_fee": "Бесплатно"
    },
    "requirements": {
      "client_category": "Физические лица",
      "age_requirement": "от 21 до 65 лет",
      "work_experience": "не менее 6 месяцев на последнем месте",
      "documents_required": [
        "Паспорт гражданина РФ",
        "Водительское удостоверение",
        "Справка 2-НДФЛ или по форме банка",
        "ИНН"
      ]
    }
  },
  "validFrom": "2026-02-03",
  "status": "active",
  "meta": {
    "title": "Автокредит на новый автомобиль от Пример Банка | Bank Select",
    "description": "Информация об автокредите на новый автомобиль от Пример Банка. Условия, ставки, требования к заёмщику."
  }
}