{
  "id": "альфа-банк--1770331449891",
  "title": "Сберегательный счет \"Максимум\"",
  "bankName": "Альфа-Банк",
  "type": "savings",
  "featured": false,
  "shortDescription": "Сберегательный счет с высоким процентом",
  "fullDescription": "Сберегательный счет с возможностью пополнения и снятия, с процентной ставкой до 8% годовых. Проценты начисляются ежемесячно с возможностью капитализации.",
  "parameters": {
    "main": {
      "Процентная ставка": "до 8% годовых",
      "Минимальная сумма": "1000 ₽",
      "Капитализация": "ежемесячная"
    },
    "fees": {
      "Открытие счета": "бесплатно",
      "Обслуживание": "бесплатно при определенных условиях"
    },
    "requirements": {
      "Возраст": "от 18 лет"
    }
  },
  "imageUrl": "/img/products/.jpg",
  "features": [
    "до 8% годовых",
    "1000 ₽",
    "ежемесячная"
  ],
  "conditions": [
    "Возраст: от 18 лет",
    "Стаж: не указан"
  ],
  "referralLink": "https://альфа-банк.ru",
  "meta": {
    "title": "Сберегательный счет \"Максимум\" от Альфа-Банк",
    "description": "Сберегательный счет с высоким процентом"
  },
  "version": {
    "date": "2026-02-05",
    "source": "system-generated",
    "updatedBy": "automated-addition"
  },
  "validFrom": "2026-02-05",
  "status": "active"
}