{
  "id": "sberbank-mortgage-standard-2024-02-03",
  "type": "mortgage",
  "bankName": "СберБанк",
  "title": "Стандартная ипотека",
  "featured": true,
  "shortDescription": "Ипотечный кредит на приобретение готового жилья с государственной поддержкой",
  "fullDescription": "Ипотечный продукт СберБанка для приобретения квартиры, дома или комнаты на первичном или вторичном рынке. Предусматривает различные программы государственной поддержки, включая семейную ипотеку, ипотеку для молодых специалистов и другие.",
  "imageUrl": "/img/bank-logos/sberbank_logo_icon.svg",
  "features": [
    "Ставка от 9.5%",
    "Первоначальный взнос от 15%",
    "Срок до 30 лет",
    "Материнский капитал"
  ],
  "conditions": [
    "Первоначальный взнос: от 15%",
    "Срок кредита: от 1 года до 30 лет",
    "Сумма кредита: от 300 000 до 60 000 000 ₽",
    "Требуемый доход: не менее 40 000 ₽ в месяц"
  ],
  "referralLink": "https://sber.ru/mortgage",
  "version": {
    "date": "2024-02-03",
    "source": "https://sber.ru",
    "updatedBy": "system"
  },
  "parameters": {
    "main": {
      "interest_rate": "от 9.5%",
      "min_down_payment": "15%",
      "loan_term": "от 1 до 30 лет",
      "min_loan_amount": "300 000 ₽",
      "max_loan_amount": "60 000 000 ₽"
    },
    "fees": {
      "application_fee": "Бесплатно",
      "issuance_fee": "1% от суммы кредита",
      "early_repayment_fee": "Бесплатно"
    },
    "requirements": {
      "client_category": "Физические лица",
      "age_requirement": "от 21 до 65 лет",
      "work_experience": "не менее 6 месяцев на последнем месте",
      "documents_required": [
        "Паспорт гражданина РФ",
        "Справка 2-НДФЛ или по форме банка",
        "ИНН",
        "Трудовая книжка"
      ]
    }
  },
  "validFrom": "2024-02-03",
  "status": "active",
  "meta": {
    "title": "Стандартная ипотека от СберБанка | Bank Select",
    "description": "Информация об ипотечном кредите от СберБанка. Условия, ставки, требования к заёмщику."
  }
}