{
  "id": "sample-deposit-product",
  "type": "deposits",
  "bankName": "Пример Банка",
  "title": "Накопительный вклад \"Выгодный\"",
  "featured": true,
  "shortDescription": "Выгодный накопительный вклад с возможностью пополнения и частичного снятия",
  "fullDescription": "Накопительный вклад \"Выгодный\" от Пример Банка - это отличное решение для тех, кто хочет сохранить и приумножить свои средства. Вклад предусматривает возможность пополнения счета и частичного снятия средств в течение срока действия вклада.",
  "imageUrl": "/img/products/sample-deposit.jpg",
  "features": [
    "Ежемесячная капитализация",
    "Возможность пополнения",
    "Частичное снятие",
    "Высокая процентная ставка"
  ],
  "conditions": [
    "Минимальная сумма вклада: 10 000 ₽",
    "Срок вклада: от 3 месяцев до 3 лет",
    "Проценты начисляются ежемесячно",
    "Возможность пополнения вклада"
  ],
  "referralLink": "https://example-bank.ru/deposits/profitable",
  "version": {
    "date": "2026-02-03",
    "source": "https://example-bank.ru",
    "updatedBy": "system"
  },
  "parameters": {
    "main": {
      "interest_rate": "8.5%",
      "min_amount": "10 000 ₽",
      "max_amount": "5 000 000 ₽",
      "term": "от 3 до 36 месяцев"
    },
    "fees": {
      "opening_fee": "Бесплатно",
      "maintenance_fee": "Бесплатно",
      "early_closure_fee": "3% от суммы вклада"
    },
    "requirements": {
      "client_category": "Физические лица",
      "documents_required": [
        "Паспорт гражданина РФ",
        "ИНН (при наличии)"
      ],
      "age_requirement": "от 18 лет"
    },
    "deposit_terms": {
      "min_deposit_amount": "10000",
      "max_deposit_amount": "5000000",
      "interest_rate": "8.5%",
      "capitalization": "да",
      "withdrawal_options": "частичное снятие после 3 месяцев",
      "replenishment_options": "возможно",
      "term_months": "от 3 до 36"
    }
  },
  "validFrom": "2026-02-03",
  "status": "active",
  "meta": {
    "title": "Накопительный вклад \"Выгодный\" от Пример Банка | Bank Select",
    "description": "Информация о накопительном вкладе \"Выгодный\" от Пример Банка. Условия, процентные ставки, требования."
  }
}