{
  "id": "lukoil-tbank-credit-card",
  "type": "credit-cards",
  "featured": true,
  "title": "Кредитная карта ЛУКОЙЛ — Т-Банк",
  "bankName": "Т-Банк",
  "shortDescription": "Кредитная карта с лимитом до 1,000,000 рублей и высокими процентными ставками.",
  "fullDescription": "Кредитная карта ЛУКОЙЛ — Т-Банк предоставляет возможность взять кредит до 1,000,000 рублей с высокими процентной ставками в зависимости от суммы кредита. Карта позволяет пользоваться бесплатными услугами и удобным управлением через мобильное приложение.",
  "imageUrl": "https://bank-select.ru/images/products/lukoil-tbank-credit-card.jpg",
  "features": [
    "Лимит задолженности до 1,000,000 рублей",
    "Высокие процентные ставки (от 29,885% до 59,858%) годовых",
    "Бесплатные услуги: выпуск карт, мобильное приложение, интернет-банк",
    "Удобный контроль задолженности через приложение"
  ],
  "conditions": [
    "Возраст от 18 лет",
    "Документы: паспорт РФ",
    "Постоянный доход"
  ],
  "referralLink": "https://www.tbank.ru/credit-cards/lukoil-tbank-credit-card",
  "parameters": {
    "main": {
      "Кредитный лимит": "до 1,000,000 ₽",
      "Льготный период": "не применим",
      "Процентная ставка": "от 29,885% до 59,858% годовых"
    },
    "fees": {
      "Выпуск карты": "бесплатно",
      "Снятие наличных": "2,9% + 290 ₽",
      "Переводы через Т-Банк": "4,9%, плюс 290 ₽ до 50,000 ₽ в расчетный период",
      "Оповещение об операциях с абонентским номером Т-Мобайл": "99 ₽ в месяц",
      "Страховая защита": "0,89% от задолженности в месяц"
    },
    "conditions": {
      "Возраст": "от 18 лет",
      "Документы": [
        "Паспорт РФ"
      ]
    }
  },
  "meta": {
    "title": "Кредитная карта ЛУКОЙЛ — Т-Банк",
    "description": "Высокая кредитная карта с лимитом до 1,000,000 рублей и высокими процентными ставками."
  },
  "version": {
    "date": "2026-02-03",
    "source": "https://bank-select.ru",
    "updatedBy": "migration-script"
  },
  "validFrom": "2026-02-03",
  "status": "active"
}
