{
  "id": "vtb-personal-loan-refinancing-2024-02-03",
  "type": "credits",
  "bankName": "ВТБ",
  "title": "Кредит на рефинансирование",
  "featured": true,
  "shortDescription": "Кредит для погашения долгов в других банках под более выгодные условия",
  "fullDescription": "Потребительский кредит ВТБ для рефинансирования задолженности по кредитам в других банках. Позволяет объединить несколько займов в один с более выгодной процентной ставкой и удобным графиком платежей.",
  "imageUrl": "/img/bank-logos/vtb_logo_icon.svg",
  "features": [
    "Ставка от 11.9%",
    "Сумма до 3 000 000 ₽",
    "Рефинансирование до 10 займов",
    "Без залога и поручительства"
  ],
  "conditions": [
    "Сумма кредита: от 50 000 до 3 000 000 ₽",
    "Срок кредита: от 1 до 7 лет",
    "Процентная ставка: от 11.9% годовых",
    "Рефинансируемые займы: до 10 кредитов"
  ],
  "referralLink": "https://vtb.ru/personal-loans/refinance",
  "version": {
    "date": "2024-02-03",
    "source": "https://vtb.ru",
    "updatedBy": "system"
  },
  "parameters": {
    "main": {
      "interest_rate": "от 11.9%",
      "loan_term": "от 1 до 7 лет",
      "min_loan_amount": "50 000 ₽",
      "max_loan_amount": "3 000 000 ₽",
      "min_age": "21 год",
      "max_age": "65 лет"
    },
    "fees": {
      "application_fee": "Бесплатно",
      "issuance_fee": "1.9% от суммы кредита",
      "early_repayment_fee": "Бесплатно",
      "monthly_service_fee": "0 ₽"
    },
    "requirements": {
      "client_category": "Физические лица",
      "age_requirement": "от 21 до 65 лет",
      "work_experience": "не менее 6 месяцев на последнем месте",
      "documents_required": [
        "Паспорт гражданина РФ",
        "Справка 2-НДФЛ или по форме банка",
        "ИНН",
        "Кредитные договоры, подлежащие рефинансированию"
      ]
    }
  },
  "validFrom": "2024-02-03",
  "status": "active",
  "meta": {
    "title": "Кредит на рефинансирование от ВТБ | Bank Select",
    "description": "Информация о кредите на рефинансирование от ВТБ. Условия, ставки, требования к заёмщику."
  }
}