{
  "id": "psb-db-your-cashback-122",
  "type": "debit-cards",
  "featured": true,
  "title": "Дебетовая карта Твой кешбэк",
  "bankName": "ПСБ",
  "shortDescription": "Дебетовая карта с кешбэком до 5% в трех категориях и 1% за перевод зарплаты.",
  "fullDescription": "Дебетовая карта ПСБ с кешбэком до 5% в трех выбранных категориях и 1% за перевод зарплаты на карту ПСБ. Карта предоставляет возможность получать вознаграждение за повседневные покупки.",
  "imageUrl": "https://bank-select.ru/images/products/psb-your-cashback.jpg",
  "features": [
    "Кешбэк до 5% в трех категориях",
    "Дополнительный 1% за перевод зарплаты на карту ПСБ",
    "Бесплатное обслуживание при выполнении условий",
    "Возможность копить кешбэк в баллах"
  ],
  "conditions": [
    "Возраст от 18 лет",
    "Документы: паспорт РФ",
    "Для бесплатного обслуживания: выполнение одного из условий"
  ],
  "referralLink": "https://www.psbank.ru/personal/cards/debit/your-cashback",
  "parameters": {
    "main": {
      "Процент кешбэка": "до 5% в трех категориях",
      "Дополнительный кешбэк": "1% за перевод зарплаты на карту ПСБ",
      "Максимальный кешбэк в месяц": "до 5000 баллов"
    },
    "fees": {
      "Выпуск карты": "бесплатно",
      "Обслуживание": "бесплатно при выполнении одного из условий: оборот по карте от 10 000 ₽ в месяц ИЛИ зарплата на карту ПСБ",
      "Снятие наличных": "Бесплатно в банкоматах ПСБ и партнеров",
      "Переводы": "Бесплатные переводы внутри ПСБ"
    },
    "requirements": {
      "Возраст": "от 18 лет",
      "Документы": [
        "Паспорт РФ"
      ]
    }
  },
  "meta": {
    "title": "Дебетовая карта Твой кешбэк от ПСБ",
    "description": "Дебетовая карта с кешбэком до 5% в трех категориях и 1% за перевод зарплаты от ПСБ"
  },
  "version": {
    "date": "2026-02-03",
    "source": "https://bank-select.ru",
    "updatedBy": "migration-script"
  },
  "validFrom": "2026-02-03",
  "status": "active"
}